258043;Ещё вопрос возник, заказывал авиабилеты через другой сайт, но для ребенка хочу сделать заказ заранее. Это возможно сделать. Если нет, будет ли какое то детское меню на борту.;24
1520509419411;Заблаговременный заказ возможен через мобильное приложение. Специального детского меню не заявлено, но вы можете выбрать из предложенного в приложении меню.;24
258087;Так, а на рейс перелетом 2,5 часа питание предоставляется? В личном кабинете не нашел;24
1520510010759;Питание предоставляется на  перелетах протяженностью 4 часа и более;24
258095;С собой если взять контейнер с готовой едой объемом более 100 мл. Пропустят?;24
258108;Ок, спасибо за быстрые ответы. А подогреть контейнер с едой возможно на борту?;24
